{
  "$schema": "https://json-schema.org/draft/2020-12/schema",
  "$id": "https://voltpilot.de/contracts/mqtt-ota-apply.schema.json",
  "title": "Cloud -> Edge Einmal-Freigabe zum Anwenden (OTA „Portal-Apply“, Konzept vp-admin-geraete-ux-k2 §6 / E3)",
  "description": "Die EINMALIGE Freigabe, ein zugewiesenes und vom Gerät bereits VERIFIZIERTES Release jetzt anzuwenden. NICHT-RETAINED, QoS1, auf ems/{tenant_id}/{site_id}/{device_id}/v2/apply - im selben v2/#-Teilbaum, den die per-Gerät-ACL seit D-2 abdeckt (keine Broker-Änderung).\n\nWAS SIE IST: wörtlich die Freigabe der :8484-Taste „Jetzt anwenden“ (otaapply.ApplyRequest) mit anderem TRANSPORT. Sie öffnet ausschließlich das ERSTE Tor von otaapply.Decide, für GENAU EIN Release (die Sequenz, die der Betreiber SAH) und GENAU EINEN Vorgang, und verfällt nach 15 Minuten (otaapply.ApplyRequestWindow). autonomy.json bleibt unberührt AUS.\n\nWAS SIE NICHT IST: eine Inhalts-Autorisierung. WAS laufen darf, entscheidet weiterhin ausschließlich das signierte Manifest gegen die eingebackene Wurzel - vom Kern UND vom Sidecar unabhängig geprüft. Dieser Umschlag ist wie der Zuweisungs-Umschlag UNSIGNIERT und damit Routing/Timing, nie Autorität. Jede weitere Sicherung gilt unverändert: Signaturkette, Anti-Rollback-Boden, Neutral-Zeit-Regel einer steuernden Anlage, Interlock, Plattenwächter, dreifach gesichertes Rückfallziel, Selbsttest, Wachhund, failed.json.\n\nWARUM NICHT-RETAINED, und das ist die tragende Entscheidung: eine retained Nachricht wird bei JEDEM Verbindungsaufbau erneut zugestellt und bliebe unbegrenzt liegen. Eine Einmal-Freigabe, die beim nächsten Reconnect wieder erscheint, wäre keine - sie würde beliebig oft erneut anwenden. Deshalb liegt sie ausdrücklich NICHT auf dem retained Zuweisungs-Slot v2/update.\n\n⚠ NICHT-retained allein genügt aber NICHT: das Gerät hält eine dauerhafte Sitzung (cleanSession=false), der Broker darf eine QoS1-Nachricht für eine abwesende Box also NACHLIEFERN. Die zweite Hälfte ist deshalb requested_at: das Gerät übernimmt diesen Stempel als Beginn seines 15-Minuten-Fensters, statt den Empfangs-Zeitpunkt zu nehmen - eine nachgelieferte Freigabe ist damit bei ihrer Ankunft bereits abgelaufen und wird abgelehnt, nicht abgelegt.\n\nFOLGE FÜR EINE OFFLINE-BOX: eine Freigabe, die sie verpasst hat, wirkt NICHT mehr. Das ist beabsichtigt - eine Zustimmung von vor drei Stunden ist keine Zustimmung für jetzt. Die Cloud zeigt dafür den eigenen Zustand „Freigabe nicht abgeholt“, statt stillschweigend zu warten; erneut freigegeben wird bewusst von Hand.",
  "type": "object",
  "additionalProperties": false,
  "required": [
    "schema_version",
    "type",
    "tenant_id",
    "site_id",
    "device_id",
    "token",
    "release",
    "requested_at"
  ],
  "properties": {
    "schema_version": {
      "const": "1.0"
    },
    "type": {
      "const": "apply_request"
    },
    "tenant_id": {
      "$ref": "#/$defs/uuid",
      "description": "MUSS dem Topic entsprechen - das Gerät verwirft eine Freigabe, deren Identität nicht auf sein eigenes Topic passt (dieselbe Regel wie bei Telemetrie, purge_data und der Zuweisung)."
    },
    "site_id": {
      "$ref": "#/$defs/uuid"
    },
    "device_id": {
      "$ref": "#/$defs/uuid"
    },
    "token": {
      "type": "string",
      "pattern": "^[0-9a-f]{16,64}$",
      "description": "Macht die Freigabe EINMALIG: der Sidecar merkt sich den zuletzt ausgeführten Token in seinem eigenen Zustand, dieselbe Freigabe kann also nie zweimal einen Tausch auslösen. Er wird von der Cloud erzeugt und vom Gerät unverändert übernommen."
    },
    "release": {
      "type": "string",
      "pattern": "^edge-\\d{4}\\.\\d{2}\\.\\d+$",
      "description": "Der Stand, den der Betreiber GESEHEN hat. Weicht er von der Zuweisung ab, die das Gerät gerade trägt, wird NICHTS angewandt - eine Zustimmung gilt für das, was auf dem Schirm stand, nicht für das, was inzwischen da liegt."
    },
    "requested_at": {
      "type": "string",
      "format": "date-time",
      "description": "Beginn des 15-Minuten-Fensters - und zwar VERBINDLICH: das Gerät übernimmt diesen Stempel, statt den Empfangs-Zeitpunkt zu nehmen. Nur so ist eine vom Broker nachgelieferte Freigabe bei ihrer Ankunft bereits abgelaufen. Ein unlesbarer Stempel gilt NICHT - im Zweifel wird nichts angewandt."
    },
    "requested_by": {
      "type": "string",
      "maxLength": 200,
      "description": "Das JWT-Subject des Portal-Admins - die Papier-Spur, dieselbe wie im Journal (`apply_requested`)."
    }
  },
  "$defs": {
    "uuid": {
      "type": "string",
      "pattern": "^[0-9a-fA-F]{8}-[0-9a-fA-F]{4}-[0-9a-fA-F]{4}-[0-9a-fA-F]{4}-[0-9a-fA-F]{12}$"
    }
  }
}
