{
  "schema_version": "1.0",
  "type": "apply_request",
  "tenant_id": "00000000-0000-0000-0000-000000000001",
  "site_id": "00000000-0000-0000-0000-000000000002",
  "device_id": "00000000-0000-0000-0000-000000000003",
  "token": "0011223344556677",
  "release": "edge-2026.08.1",
  "requested_at": "2026-08-05T09:12:00Z"
}
